{
  "schemaVersion": 1,
  "generatedAt": "2026-08-07T12:00:00Z",
  "expiresAt": "2026-08-14T12:00:00Z",
  "components": [
    {
      "id": "future-provider",
      "authoritativeSource": "https://example.invalid/future-provider",
      "ownership": "external",
      "releases": [
        {
          "version": "2.0.0",
          "channel": "stable",
          "protocol": {
            "min": "2.0.0",
            "max": "2.9.0"
          },
          "artifacts": []
        }
      ]
    }
  ],
  "signature": {
    "algorithm": "ed25519",
    "keyId": "fixture-key-1",
    "value": "aW5jb21wYXRpYmxlLWZpeHR1cmU="
  }
}

