{
  "schemaVersion": 1,
  "generatedAt": "2026-08-07T12:00:00Z",
  "expiresAt": "2026-08-14T12:00:00Z",
  "components": [
    {
      "id": "token-shrinker",
      "authoritativeSource": "https://github.com/suriya911/Token-Shrinker",
      "ownership": "cargo",
      "releases": [
        {
          "version": "0.1.0-alpha.1",
          "channel": "alpha",
          "protocol": {
            "min": "1.0.0",
            "max": "1.0.0"
          },
          "artifacts": [
            {
              "platform": "windows-x64",
              "url": "https://github.com/suriya911/Token-Shrinker/releases/download/v0.1.0-alpha.1/token-shrinker-windows-x64.zip",
              "sha256": "1111111111111111111111111111111111111111111111111111111111111111"
            }
          ]
        }
      ]
    }
  ],
  "signature": {
    "algorithm": "ed25519",
    "keyId": "fixture-key-1",
    "value": "cFN3zefpLhuCX30kwv3Xh2phEKGiCK7S17mRDO4efkje87qOd+yjtMhRvV9EsnXryRhOwnm90M6A+mEK4WuLBw=="
  }
}
